{
  "version": "1.0",
  "generated": "2026-05-10",
  "scope": [
    "index.html",
    "capital.html",
    "revenue.html",
    "compute.html",
    "usage.html",
    "power.html"
  ],
  "entries": [
    {
      "id": "index.market_aggregate_tokens.value",
      "page": "index.html",
      "anchor_selector": "[data-num][data-line=\"11\"]",
      "anchor_dom_id": null,
      "current_rendered_value": "$745B",
      "semantic": "market_aggregate.tokens",
      "source_state": "editorial",
      "source_path": "site-data.cumulative.capex_total",
      "source_path_exists": true,
      "source_path_candidates": [
        "site-data.cumulative.capex_total"
      ],
      "editorial_fallback": {
        "value": 745.0,
        "unit": "B",
        "raw": "$745B",
        "origin": "html_literal_at_capture",
        "audit_ref": "index.html:11"
      },
      "supersession_threshold": {
        "provenance_score_min": 0.7,
        "consensus_weight_min": "indicative"
      },
      "format": "currency_b_compact",
      "last_changed": null,
      "notion_id": "35c57414-da2a-8108-a534-d474234ff82c",
      "_capture": {
        "line": 11,
        "context": "<meta property=\"og:description\" content=\"$745B of infrastructure investment. $43B of AI compute revenue earned. $17B of customer-paid Apps Revenue. ~360T tokens/day. The full AI economy, triangulated from primary sources.\">",
        "binding_hint": null
      }
    },
    {
      "id": "index.market_aggregate_tokens.value_2",
      "page": "index.html",
      "anchor_selector": "[data-num][data-line=\"11\"]",
      "anchor_dom_id": null,
      "current_rendered_value": "$43B",
      "semantic": "market_aggregate.tokens",
      "source_state": "editorial",
      "source_path": "site-data.compute.compute_revenue_2025_gross_usd_b",
      "source_path_exists": true,
      "source_path_candidates": [
        "site-data.compute.compute_revenue_2025_gross_usd_b"
      ],
      "editorial_fallback": {
        "value": 43.0,
        "unit": "B",
        "raw": "$43B",
        "origin": "html_literal_at_capture",
        "audit_ref": "index.html:11"
      },
      "supersession_threshold": {
        "provenance_score_min": 0.7,
        "consensus_weight_min": "indicative"
      },
      "format": "currency_b_compact",
      "last_changed": null,
      "notion_id": "35c57414-da2a-8151-a54b-cb0b96992fb5",
      "_capture": {
        "line": 11,
        "context": "<meta property=\"og:description\" content=\"$745B of infrastructure investment. $43B of AI compute revenue earned. $17B of customer-paid Apps Revenue. ~360T tokens/day. The full AI economy, triangulated from primary sources.\">",
        "binding_hint": null
      }
    },
    {
      "id": "index.market_aggregate_tokens.value_3",
      "page": "index.html",
      "anchor_selector": "[data-num][data-line=\"11\"]",
      "anchor_dom_id": null,
      "current_rendered_value": "$17B",
      "semantic": "market_aggregate.tokens",
      "source_state": "editorial",
      "source_path": "site-data.sankey.totalCustomerRevenue_gross",
      "source_path_exists": true,
      "source_path_candidates": [
        "site-data.sankey.totalCustomerRevenue_gross"
      ],
      "editorial_fallback": {
        "value": 17.0,
        "unit": "B",
        "raw": "$17B",
        "origin": "html_literal_at_capture",
        "audit_ref": "index.html:11"
      },
      "supersession_threshold": {
        "provenance_score_min": 0.7,
        "consensus_weight_min": "indicative"
      },
      "format": "currency_b_compact",
      "last_changed": null,
      "notion_id": "35c57414-da2a-819c-9e0c-fc9a56b51be5",
      "_capture": {
        "line": 11,
        "context": "<meta property=\"og:description\" content=\"$745B of infrastructure investment. $43B of AI compute revenue earned. $17B of customer-paid Apps Revenue. ~360T tokens/day. The full AI economy, triangulated from primary sources.\">",
        "binding_hint": null
      },
      "pages": [
        "index.html",
        "capital.html"
      ],
      "anchor_selectors": [
        "[data-num][data-line=\"11\"]",
        "js:LAG_RAW[2].revenue"
      ]
    },
    {
      "id": "index.market_aggregate_tokens.value_4",
      "page": "index.html",
      "anchor_selector": "[data-num][data-line=\"11\"]",
      "anchor_dom_id": null,
      "current_rendered_value": "~360T",
      "semantic": "market_aggregate.tokens",
      "source_state": "editorial",
      "source_path": "site-data.cumulative.tokens_2025_annualized",
      "source_path_exists": true,
      "source_path_candidates": [
        "site-data.cumulative.tokens_2025_annualized"
      ],
      "editorial_fallback": {
        "value": 360.0,
        "unit": "T",
        "raw": "~360T",
        "origin": "html_literal_at_capture",
        "audit_ref": "index.html:11"
      },
      "supersession_threshold": {
        "provenance_score_min": 0.7,
        "consensus_weight_min": "indicative"
      },
      "format": "tokens_compact",
      "last_changed": null,
      "notion_id": "35c57414-da2a-8145-b242-d1b940dd28b7",
      "_capture": {
        "line": 11,
        "context": "<meta property=\"og:description\" content=\"$745B of infrastructure investment. $43B of AI compute revenue earned. $17B of customer-paid Apps Revenue. ~360T tokens/day. The full AI economy, triangulated from primary sources.\">",
        "binding_hint": null
      }
    },
    {
      "id": "index.dom.ais_capex_figure",
      "page": "index.html",
      "anchor_selector": "#ais-capex-figure",
      "anchor_dom_id": "ais-capex-figure",
      "current_rendered_value": "$330B",
      "semantic": "market_aggregate.capex_annual",
      "source_state": "editorial",
      "source_path": "entities.market_aggregates.2025.total_capex",
      "source_path_exists": true,
      "source_path_candidates": [
        "entities.market_aggregates.2025.total_capex"
      ],
      "editorial_fallback": {
        "value": 330.0,
        "unit": "B",
        "raw": "$330B",
        "origin": "html_literal_at_capture",
        "audit_ref": "index.html:227"
      },
      "supersession_threshold": {
        "provenance_score_min": 0.7,
        "consensus_weight_min": "indicative"
      },
      "format": "currency_b_compact",
      "last_changed": null,
      "notion_id": "35c57414-da2a-8147-ad08-c26499dc34dd",
      "_capture": {
        "line": 227,
        "context": "<span class=\"ais-figure\" id=\"ais-capex-figure\">$330B</span>",
        "binding_hint": null
      }
    },
    {
      "id": "index.dom.ais_usage_figure",
      "page": "index.html",
      "anchor_selector": "#ais-usage-figure",
      "anchor_dom_id": "ais-usage-figure",
      "current_rendered_value": "$164B",
      "semantic": "uncategorised",
      "source_state": "editorial",
      "source_path": "site-data.compute.layer_stack_ratios.usage_revenue_2025_usd_b",
      "source_path_exists": false,
      "source_path_candidates": [
        "site-data.compute.layer_stack_ratios.usage_revenue_2025_usd_b"
      ],
      "editorial_fallback": {
        "value": 164.0,
        "unit": "B",
        "raw": "$164B",
        "origin": "html_literal_at_capture",
        "audit_ref": "index.html:237"
      },
      "supersession_threshold": {
        "provenance_score_min": 0.7,
        "consensus_weight_min": "indicative"
      },
      "format": "currency_b_compact",
      "last_changed": null,
      "notion_id": "35c57414-da2a-81c4-adf7-d76db6540354",
      "_capture": {
        "line": 237,
        "context": "<span class=\"ais-figure\" id=\"ais-usage-figure\">$164B</span>",
        "binding_hint": null
      }
    },
    {
      "id": "index.dom.ais_compute_figure",
      "page": "index.html",
      "anchor_selector": "#ais-compute-figure",
      "anchor_dom_id": "ais-compute-figure",
      "current_rendered_value": "$43.1B",
      "semantic": "uncategorised",
      "source_state": "editorial",
      "source_path": "site-data.compute.compute_revenue_2025_gross_usd_b",
      "source_path_exists": true,
      "source_path_candidates": [
        "site-data.compute.compute_revenue_2025_gross_usd_b",
        "site-data.compute.compute_revenue_2025_gross_sum_of_quarterlies_usd_b",
        "site-data.compute.layer_stack_ratios.compute_revenue_2025_gross_usd_b",
        "site-data.arrModel.compute.netExternal",
        "site-data.arrModel.compute.subtotal",
        "site-data.arrModel.combined.compute_net",
        "site-data.meta.acceptedPoints"
      ],
      "editorial_fallback": {
        "value": 43.1,
        "unit": "B",
        "raw": "$43.1B",
        "origin": "html_literal_at_capture",
        "audit_ref": "index.html:246"
      },
      "supersession_threshold": {
        "provenance_score_min": 0.7,
        "consensus_weight_min": "indicative"
      },
      "format": "currency_b_compact",
      "last_changed": null,
      "notion_id": "35c57414-da2a-818c-a7f7-ed7e4499d027",
      "_capture": {
        "line": 246,
        "context": "<span class=\"ais-figure-out\" id=\"ais-compute-figure\">$43.1B</span>",
        "binding_hint": null
      }
    },
    {
      "id": "index.dom.ais_power_figure",
      "page": "index.html",
      "anchor_selector": "#ais-power-figure",
      "anchor_dom_id": "ais-power-figure",
      "current_rendered_value": "$25B",
      "semantic": "market_aggregate.power",
      "source_state": "editorial",
      "source_path": "site-data.compute.layer_stack_ratios.power_revenue_2025_usd_b",
      "source_path_exists": true,
      "source_path_candidates": [
        "site-data.compute.layer_stack_ratios.power_revenue_2025_usd_b"
      ],
      "editorial_fallback": {
        "value": 25.0,
        "unit": "B",
        "raw": "$25B",
        "origin": "html_literal_at_capture",
        "audit_ref": "index.html:256"
      },
      "supersession_threshold": {
        "provenance_score_min": 0.7,
        "consensus_weight_min": "indicative"
      },
      "format": "currency_b_compact",